{
  "schemaVersion": "ufuq.astronomy-experiment-registry.v1",
  "protocolVersion": "2C.5A-v1",
  "protocolDocument": "docs/spikes/PHASE1_SCIENTIFIC_EXPERIMENT_PROTOCOL.md",
  "fixtureSchema": "ufuq.astronomy-experiment-fixture.v1",
  "resultSchema": "ufuq.astronomy-experiment-result.v1",
  "errorBudgetStatus": "NOT_ESTABLISHED_AST_006_OPEN",
  "classificationVocabulary": [
    "RUNNABLE_SYNTHETIC_NOW",
    "BLOCKED_BY_SOURCE_AUTHORITY",
    "BLOCKED_BY_PROJECT_DECISION",
    "BLOCKED_BY_REVIEW",
    "BLOCKED_BY_REQUIRED_DATA",
    "DEFERRED_TO_PRODUCTION_IMPLEMENTATION"
  ],
  "firstBatch": {
    "batchId": "2C.5B-BATCH-01",
    "status": "PROPOSED_SYNTHETIC_EXECUTION_ONLY",
    "inputClassification": "SYNTHETIC_EXPERIMENT_INPUT",
    "prohibitedInputClasses": ["SOURCE_DERIVED", "PRODUCTION_GENERATED"],
    "prohibitedSourceMaterial": [
      "I311_CATALOGUE_ROWS",
      "HIP_SOURCE_DERIVED_VALUES",
      "CATALOGUE_SOURCE_BYTES"
    ],
    "prohibitedClaims": [
      "I311_EPOCH_TIME_SCALE_RESOLVED",
      "PRODUCTION_APPROVAL",
      "INDEPENDENT_SCIENTIFIC_VALIDATION_FROM_SHARED_LINEAGE",
      "SCIENTIFIC_TOLERANCE_ACCEPTED"
    ],
    "executionGroups": [
      {
        "groupId": "EPOCH_LABEL_GUARDS",
        "members": [
          {
            "experimentId": "2C.1-EXP-01",
            "scopeId": "2C.1-EXP-01-BATCH01-SYNTHETIC",
            "includedPartitions": ["TT_TDB_UTC_LABEL_SENSITIVITY"]
          },
          {
            "experimentId": "2C.1-EXP-02",
            "scopeId": "2C.1-EXP-02-BATCH01-SYNTHETIC",
            "includedPartitions": ["CALENDAR_DECIMAL_YEAR_VS_JULIAN_EPOCH"]
          },
          {
            "experimentId": "2C.1-EXP-03",
            "scopeId": "2C.1-EXP-03-BATCH01-SYNTHETIC",
            "includedPartitions": ["BESSELIAN_REJECTION_GUARD"]
          }
        ]
      },
      {
        "groupId": "ROUTE_AND_CONVENTION_CONSISTENCY",
        "members": [
          {
            "experimentId": "2C.2-EXP-01",
            "scopeId": "2C.2-EXP-01-BATCH01-SYNTHETIC",
            "includedPartitions": ["DECOMPOSED_VS_COMPOSED_IDENTICAL_SYNTHETIC_INPUTS"]
          }
        ]
      },
      {
        "groupId": "MOTION_CONVENTION_GUARDS",
        "members": [
          {
            "experimentId": "2C.2-EXP-04",
            "scopeId": "2C.2-EXP-04-BATCH01-SYNTHETIC-CONVENTION-GUARDS",
            "includedPartitions": [
              "OMITTED_COSINE_GUARD",
              "DOUBLE_COSINE_GUARD",
              "DECLARED_TARGET_EPOCH_LABEL_GUARD",
              "TWO_PART_JD_SPLIT_INVARIANT",
              "WARNING_STATUS_PRESERVATION"
            ]
          }
        ]
      },
      {
        "groupId": "DETERMINISTIC_REPLAY",
        "members": [
          {
            "experimentId": "2C.3-EXP-01",
            "scopeId": "2C.3-EXP-01-BATCH01-SYNTHETIC",
            "includedPartitions": ["TWO_RUN_CANONICAL_REPLAY", "FRESH_ISOLATED_ENVIRONMENT_REPLAY"]
          }
        ]
      },
      {
        "groupId": "OPTIONAL_STATE_GUARDS",
        "members": [
          {
            "experimentId": "2C.4-EXP-05",
            "scopeId": "2C.4-EXP-05-BATCH01-SYNTHETIC",
            "includedPartitions": ["BELOW_HORIZON_GEOMETRIC_STATE_PRESERVATION"]
          },
          {
            "experimentId": "2C.4-EXP-06",
            "scopeId": "2C.4-EXP-06-BATCH01-SYNTHETIC",
            "includedPartitions": ["NO_DEFAULT_ATMOSPHERE_GUARD"]
          },
          {
            "experimentId": "2C.4-EXP-07",
            "scopeId": "2C.4-EXP-07-BATCH01-SYNTHETIC",
            "includedPartitions": ["VISIBILITY_COMPONENT_INDEPENDENCE"]
          }
        ]
      }
    ]
  },
  "experiments": [
    {
      "experimentId": "2C.1-EXP-01",
      "title": "Julian TT/TDB/UTC epoch-label sensitivity",
      "currentClassification": "RUNNABLE_SYNTHETIC_NOW",
      "protocolRecord": "PHASE1_SCIENTIFIC_EXPERIMENT_PROTOCOL.md#milestone-2c1",
      "scientificQuestion": "How do explicit TT, TDB, and UTC labels on the same synthetic Julian epoch change the represented instant and propagated direction?",
      "mayEstablish": ["Measure scale sensitivity and warning/status differences."],
      "cannotEstablish": ["Establish the I/311 time scale, approve TT, or set a tolerance."],
      "inputClasses": ["SYNTHETIC", "EXTERNAL_AUTHORITATIVE_ARTIFACT"],
      "referenceDependencies": [
        "Astropy 8.0.1 Time/apply_space_motion",
        "PyERFA 2.0.1.5 pmsafe",
        "smoke-only pinned leap artifact"
      ],
      "requiredInputPolicy": "Explicit ICRS, jyear scale, two-part TDB JD, mas per Julian year, parallax/RV, pinned smoke-only leap artifact, and synthetic ITRS geocentre [0,0,0] m as the TT/TDB conversion reference; no EOP, physical/topocentric or production observer, meteorology, or ephemeris.",
      "parameterPartitions": [
        "TT/TDB/UTC labels",
        "zero/high motion",
        "high declination",
        "parallax/RV branches",
        "alternative JD splits"
      ],
      "comparisonLineage": "SAME_ERFA_SOFA_FAMILY",
      "metrics": [
        "GREAT_CIRCLE_ANGULAR_SEPARATION",
        "COMPONENT_RESIDUALS",
        "WARNINGS",
        "STRUCTURED_STATUSES",
        "DETERMINISTIC_BYTES",
        "DETERMINISTIC_SHA256"
      ],
      "determinismProfile": "TWO_RUN_CANONICAL_REPLAY",
      "hashProfile": "ENVIRONMENT_REGISTRY_SCHEMA_FIXTURE_RESULT_SOURCE_AND_ARTIFACTS",
      "acceptanceMode": "EXACT_INVARIANT_AND_MEASUREMENT",
      "reviewerApproval": "AST-003 and AST-006 approval before measurements inform an epoch policy.",
      "followUpDecisions": [
        "Bound candidate epoch-label consequences without deciding source meaning."
      ],
      "blockers": [],
      "firstBatch": true
    },
    {
      "experimentId": "2C.1-EXP-02",
      "title": "Calendar decimal-year comparison",
      "currentClassification": "RUNNABLE_SYNTHETIC_NOW",
      "protocolRecord": "PHASE1_SCIENTIFIC_EXPERIMENT_PROTOCOL.md#milestone-2c1",
      "scientificQuestion": "How does calendar decimal year differ from a Julian epoch under otherwise identical synthetic motion?",
      "mayEstablish": ["Measure instant, elapsed-time, and direction differences."],
      "cannotEstablish": ["Make decimalyear an I/311 interpretation or define acceptance."],
      "inputClasses": ["SYNTHETIC", "EXTERNAL_AUTHORITATIVE_ARTIFACT"],
      "referenceDependencies": [
        "Astropy 8.0.1 TimeDecimalYear/TimeJulianEpoch/apply_space_motion",
        "smoke-only pinned leap artifact consumed by TT/TDB conversion"
      ],
      "requiredInputPolicy": "Explicit representation and scale, ICRS, motion units, target instant, parallax/RV, pinned smoke-only leap artifact, and synthetic ITRS geocentre [0,0,0] m as the TT/TDB conversion reference; no physical/topocentric observer or production data policy.",
      "parameterPartitions": [
        "leap/non-leap calendar years",
        "zero/high motion",
        "identical target instants"
      ],
      "comparisonLineage": "SAME_ERFA_SOFA_FAMILY",
      "metrics": [
        "GREAT_CIRCLE_ANGULAR_SEPARATION",
        "COMPONENT_RESIDUALS",
        "WARNINGS",
        "STRUCTURED_STATUSES",
        "DETERMINISTIC_SHA256"
      ],
      "determinismProfile": "TWO_RUN_CANONICAL_REPLAY",
      "hashProfile": "ENVIRONMENT_REGISTRY_SCHEMA_FIXTURE_RESULT_SOURCE_AND_ARTIFACTS",
      "acceptanceMode": "MEASUREMENT_ONLY",
      "reviewerApproval": "AST-003 and AST-006 approval before measurements inform an epoch policy.",
      "followUpDecisions": ["Reject or bound the calendar-year alternative."],
      "blockers": [],
      "firstBatch": true
    },
    {
      "experimentId": "2C.1-EXP-03",
      "title": "Besselian rejection guard",
      "currentClassification": "RUNNABLE_SYNTHETIC_NOW",
      "protocolRecord": "PHASE1_SCIENTIFIC_EXPERIMENT_PROTOCOL.md#milestone-2c1",
      "scientificQuestion": "Does the protocol prevent Besselian byear from being treated as an I/311 candidate?",
      "mayEstablish": [
        "Establish an exact candidate-set rejection guard and record diagnostic differences."
      ],
      "cannotEstablish": ["Infer catalogue intent from numerical separation."],
      "inputClasses": ["SYNTHETIC", "EXTERNAL_AUTHORITATIVE_ARTIFACT"],
      "referenceDependencies": [
        "Astropy 8.0.1 TimeBesselianEpoch/TimeJulianEpoch",
        "smoke-only pinned leap artifact consumed by TT/TDB conversion"
      ],
      "requiredInputPolicy": "Explicit diagnostic TT scale, pinned smoke-only leap artifact, and synthetic ITRS geocentre [0,0,0] m as the TT/TDB conversion reference; byear is labelled rejected, never a source candidate, and no physical/topocentric observer or production data policy follows.",
      "parameterPartitions": ["ordinary/high motion", "deliberately mislabelled fixture"],
      "comparisonLineage": "STRUCTURAL_INVARIANT",
      "metrics": [
        "COMPONENT_RESIDUALS",
        "STRUCTURED_STATUSES",
        "DETERMINISTIC_BYTES",
        "DETERMINISTIC_SHA256"
      ],
      "determinismProfile": "TWO_RUN_CANONICAL_REPLAY",
      "hashProfile": "ENVIRONMENT_REGISTRY_SCHEMA_FIXTURE_RESULT_SOURCE_AND_ARTIFACTS",
      "acceptanceMode": "EXACT_INVARIANT_AND_MEASUREMENT",
      "reviewerApproval": "AST-003 approval before the guard becomes part of a production epoch adapter.",
      "followUpDecisions": ["Freeze the rejection path for unsupported epoch representations."],
      "blockers": [],
      "firstBatch": true
    },
    {
      "experimentId": "2C.2-EXP-01",
      "title": "Componentized-route equivalence",
      "currentClassification": "RUNNABLE_SYNTHETIC_NOW",
      "protocolRecord": "PHASE1_SCIENTIFIC_EXPERIMENT_PROTOCOL.md#milestone-2c2",
      "scientificQuestion": "Is the decomposed ERFA route internally consistent with composed atco13 for identical explicit synthetic inputs?",
      "mayEstablish": ["Detect wiring, unit, convention, status, and intermediate-state faults."],
      "cannotEstablish": [